{
  "dossier_id": "D-001",
  "step": "comps-market",
  "artifact": "comparables_proposes.json",
  "date_reference": "2026-04-28",
  "comparables": [
    {
      "comparable_id": "C1",
      "prix_vente": 500000.0,
      "source_id": "SRC-1",
      "score": 0.5375,
      "date_vente": "",
      "score_details": {
        "score": 0.5375,
        "weighted_score": 0.5375,
        "components": {
          "distance": 0.5,
          "recency": 0.5,
          "surface_similarity": 0.5,
          "confidence": 0.65,
          "source_quality": 0.65
        },
        "weights": {
          "distance": 0.3,
          "recency": 0.25,
          "surface_similarity": 0.2,
          "confidence": 0.15,
          "source_quality": 0.1
        },
        "penalties": {},
        "rationale": [
          "Meilleure composante: confidence=0.65",
          "Composante la plus faible: distance=0.50"
        ]
      }
    }
  ],
  "source_fixture": "case_nominal.json"
}