{
  "dossier_id": "D-PILOTE-RES-003",
  "step": "comps-market",
  "artifact": "comparables_proposes.json",
  "date_reference": "2026-04-28",
  "comparables": [
    {
      "comparable_id": "CP-201",
      "prix_vente": 625000.0,
      "source_id": "SRC-VENTE-201",
      "score": 0.5367,
      "date_vente": "2026-06-15",
      "score_details": {
        "score": 0.5367,
        "weighted_score": 0.8867,
        "components": {
          "distance": 0.86,
          "recency": 0.9562,
          "surface_similarity": 0.9706,
          "confidence": 0.87,
          "source_quality": 0.65
        },
        "weights": {
          "distance": 0.3,
          "recency": 0.25,
          "surface_similarity": 0.2,
          "confidence": 0.15,
          "source_quality": 0.1
        },
        "penalties": {
          "future_sale": 0.35
        },
        "rationale": [
          "Meilleure composante: surface_similarity=0.97",
          "Composante la plus faible: source_quality=0.65",
          "Penalite future_sale: -0.35"
        ]
      }
    }
  ],
  "source_fixture": "case_pilote_revision_conformite.json"
}