{
  "dossier_id": "D-PILOTE-RES-002",
  "step": "comps-market",
  "artifact": "comparables_proposes.json",
  "date_reference": "2026-04-28",
  "comparables": [
    {
      "comparable_id": "CP-102",
      "prix_vente": 397500.0,
      "source_id": "SRC-VENTE-102",
      "score": 0.6481,
      "date_vente": "2025-12-12",
      "score_details": {
        "score": 0.6481,
        "weighted_score": 0.6481,
        "components": {
          "distance": 0.2667,
          "recency": 0.8749,
          "surface_similarity": 0.9643,
          "confidence": 0.61,
          "source_quality": 0.65
        },
        "weights": {
          "distance": 0.3,
          "recency": 0.25,
          "surface_similarity": 0.2,
          "confidence": 0.15,
          "source_quality": 0.1
        },
        "penalties": {},
        "rationale": [
          "Meilleure composante: surface_similarity=0.96",
          "Composante la plus faible: distance=0.27"
        ]
      }
    },
    {
      "comparable_id": "CP-101",
      "prix_vente": 410000.0,
      "source_id": "SRC-VENTE-101",
      "score": 0.5732,
      "date_vente": "2026-01-18",
      "score_details": {
        "score": 0.5732,
        "weighted_score": 0.5732,
        "components": {
          "distance": 0.0,
          "recency": 0.9087,
          "surface_similarity": 0.9703,
          "confidence": 0.58,
          "source_quality": 0.65
        },
        "weights": {
          "distance": 0.3,
          "recency": 0.25,
          "surface_similarity": 0.2,
          "confidence": 0.15,
          "source_quality": 0.1
        },
        "penalties": {},
        "rationale": [
          "Meilleure composante: surface_similarity=0.97",
          "Composante la plus faible: distance=0.00"
        ]
      }
    }
  ],
  "source_fixture": "case_pilote_confiance_limitee.json"
}